{
  "$schema": "https://json-schema.org/draft/2020-12/schema",
  "type": "object",
  "additionalProperties": false,
  "$id": "https://disponit.no/skjema/m44fasitartefakt-v1.json",
  "title": "m44 fasitartefakt (m44-fasit-v1)",
  "comment": "Det syntetiske mottakersettet (deploy/staging/m44_fasit.py) drevet gjennom kundens egne doerer, sveipet av drift/kampanjesveip.kjor() som sveiperollen, og maalt mot TRE haandskrevne fasiter: funnene (samtykke trukket/utloept, over frekvens, ingen grense), koeen slik flaten viser den, og evidenskjeden inkl. samtykkehistorikken. Avvikene baeres i artefaktet saa dommen kan RE-REGNES av porten. CI driver samme sett mot lokal base (test_m44_fasit_port). Skrevet av deploy/staging/m44-fasit-artefakt.py.",
  "required": [
    "krav_id",
    "ts",
    "bestatt",
    "oppsett",
    "maalt",
    "avvik"
  ],
  "properties": {
    "krav_id": {
      "const": "m44-fasit-v1"
    },
    "ts": {
      "type": "string",
      "minLength": 1
    },
    "bestatt": {
      "type": "boolean"
    },
    "oppsett": {
      "type": "object",
      "additionalProperties": false,
      "required": [
        "modul",
        "vert",
        "sett_versjon",
        "sett_sha256",
        "bevisrot_sha256",
        "tenanter"
      ],
      "properties": {
        "modul": {
          "const": "m44_kampanje"
        },
        "vert": {
          "type": "string",
          "minLength": 1
        },
        "sett_versjon": {
          "type": "string",
          "minLength": 1,
          "comment": "bygg_sett()-versjonen som drev settet."
        },
        "sett_sha256": {
          "type": "string",
          "pattern": "^[0-9a-f]{64}$",
          "comment": "sha256 av settdriverens bytes (deploy/staging/m44_fasit.py) slik kjoeringen FAKTISK brukte den. sett_versjon er en haandholdt streng; denne er identiteten. Porten krever likhet med de innsjekkede bytene."
        },
        "bevisrot_sha256": {
          "type": "string",
          "pattern": "^[0-9a-f]{64}$",
          "comment": "EN digest over hele m44-produsentflaten (manifestskjema.M44_BEVISROT_FILER), re-regnet av porten over sitt eget tre."
        },
        "tenanter": {
          "type": "array",
          "minItems": 2,
          "items": {
            "type": "string",
            "minLength": 1
          },
          "comment": "Tenantene runden kjoerte mot - en MED grense (strammet etter plasseringen) og en UTEN. Begge kreves: uten den grenseloese er ingen_grense umaalt."
        }
      }
    },
    "maalt": {
      "type": "object",
      "additionalProperties": false,
      "required": [
        "mottakere",
        "ventede_funn",
        "evidenshendelser",
        "funnavvik",
        "koeavvik",
        "evidensavvik",
        "sveipetid_ms",
        "sveip_tenanter"
      ],
      "properties": {
        "mottakere": {
          "type": "integer",
          "minimum": 1,
          "comment": "Antall mottakere i settet - summen over begge tenantene."
        },
        "ventede_funn": {
          "type": "integer",
          "minimum": 1,
          "comment": "Antall funn fasiten venter."
        },
        "evidenshendelser": {
          "type": "integer",
          "minimum": 1,
          "comment": "Hendelser fasiten venter i revisjonsloggen (kilde m44_kampanje): en per doer som ble kalt. Samtykkehistorikken maales i tillegg per mottaker."
        },
        "funnavvik": {
          "type": "integer",
          "minimum": 0
        },
        "koeavvik": {
          "type": "integer",
          "minimum": 0
        },
        "evidensavvik": {
          "type": "integer",
          "minimum": 0
        },
        "sveipetid_ms": {
          "type": "integer",
          "minimum": 0,
          "comment": "Veggklokketid for kampanjesveipen i denne runden."
        },
        "sveip_tenanter": {
          "type": "integer",
          "minimum": 1,
          "comment": "Antall tenanter sveipen rapporterte - nevneren til sveipetid_ms; kryss-tenant."
        }
      }
    },
    "avvik": {
      "type": "object",
      "additionalProperties": {
        "type": "object",
        "additionalProperties": false,
        "required": [
          "funnavvik",
          "koeavvik",
          "evidensavvik"
        ],
        "properties": {
          "funnavvik": {
            "type": "array",
            "items": {
              "type": "string"
            }
          },
          "koeavvik": {
            "type": "array",
            "items": {
              "type": "string"
            }
          },
          "evidensavvik": {
            "type": "array",
            "items": {
              "type": "string"
            }
          }
        }
      },
      "comment": "Avvikene per tenantrolle, ordrett. Porten teller dem paa nytt og sammenligner med maalt - en telling som spriker fra listen er to ulike kjoeringer i samme fil."
    }
  }
}
